### ISSUE TITLE
Unable to query source servers

### ISSUE THREAD

**Issue by Bubka3** [Austinb/GameQ#211]
Using GameQ v2, CentOS 6.6 (x64), PHP 5.4.36, Apache 2.2.15.
Sockets is enabled along with zlib and bzip2.

Test Script: http://bubka3.com/gameq_test.zip

I am unable to query any source server, it always returns offline. There are no errors anywhere, even with debug mode on. Using a packet capture tool, I can see the Source Engine Query packet response being returned from the queried server.

However, a Teamspeak 3 server query works fine.

```
tcpdump -n host 74.91.123.139
tcpdump: verbose output suppressed, use -v or -vv for full protocol decode
listening on eth0, link-type EN10MB (Ethernet), capture size 65535 bytes
21:26:42.351983 IP 192.223.31.133.50662 > 74.91.123.139.27015: UDP, length 9
21:26:42.553126 IP 192.223.31.133.48457 > 74.91.123.139.27015: UDP, length 25
21:26:42.553854 IP 192.223.31.133.38567 > 74.91.123.139.27015: UDP, length 7
21:26:42.554652 IP 192.223.31.133.56508 > 74.91.123.139.27015: UDP, length 7
21:26:42.653341 IP 74.91.123.139.27015 > 192.223.31.133.48457: UDP, length 143
5 packets captured
5 packets received by filter
0 packets dropped by kernel
```

**Comment by Verox-** [comment]
I queried the server from 2 separate IPs and received this response both times: **\ff\ff\ff\fflBanned by server\n\00**

There might be some kind of setting to enable serverquery in the server's settings.

Edit: I tried querying a few other servers and they worked fine, it appears to be a configuration issue with the server.

**Comment by Bubka3** [comment]
I'm not sure what where you got that response from. If you were banned from the server you wouldn't be getting any packets back, it would just be dead.

**Comment by Verox-** [comment]
This is your server
![Returning info](http://i.imgur.com/gTt94DX.png)

This is an abbreviated return from another server
![Returning info](http://i.imgur.com/9SgqPQF.png)

I have run this query from a few different machines (different IPs, obviously) with the same result. Also, using GameQ to query any other No More Room In Hell server works as expected.

**Comment by Austinb** [comment]
My guess is the server has some kind of protection or it has banned your ip using the banlist for the actual game.  I believe when you are ip banned you can not get any info about the server but I may be wrong on that.

Please test using another servers or pick some random servers from gametracker.com.  What game (CS:GO, TF2, etc...) is it you are trying to get information from?

**Comment by Verox-** [comment]
I've updated my previous comment, It'd be an amazing coincidence if both my machine, a friend's machine and a VPS half-way across the world were all IP banned by the server.

**Comment by ceribik** [comment]
I suspect the host (NFOServers) might be blocking it:

http://www.nfoservers.com/forums/viewtopic.php?f=25&t=4931#p36612

**Comment by Austinb** [comment]
In your updated response you can see the beginning of the proper return to the query response the system is expecting.  I was unaware of any "banned" response in the A2S protocol so it appears to be a custom response built by a server mod or something at the game level.  Does anyone else have any more information on this?

**Comment by ceribik** [comment]
@Austinb See my comment just above yours

**Comment by Verox-** [comment]
It'd be a strange behaviour if NFOServers' firewall was blocking it then sending a response, the point of DDoS protection is to reduce the amount of traffic, not double it.

**Comment by Austinb** [comment]
@ceribik  I scanned it but I would agree with @Verox- that in this case I would doubt they would return a response in favor of just dropping the traffic altogether.  Also in my quick glance of the thread I did not see any mention of a "banned" response to that query.

**Comment by ceribik** [comment]
@Verox- It could have a varied (ramping up) response. Initially it could send that banned response and then eventually it might just stop responding.

@Bubka3 It's probably worth submitting a ticket with NFOServers.

**Comment by Bubka3** [comment]
It's not just that server, I can't query any source server. It was simply an example.

**Comment by Austinb** [comment]
@Bubka3 Please provide other example ips where you are getting this response.  In your updated response the other server (71.94.114.248) the response is correct.   Are you unable to get this server to work correctly and return a response?

**Comment by Bubka3** [comment]
I am unable to get **ANY** source server to return data to GameQ.

I am not getting any banned response, I don't know where or how that user is getting a banned response.

**Comment by Verox-** [comment]
Oh if you're not specifically trying to query that server then I guess that's just a bizarre random occurrence... the admin has probably banned an entire subnet I'm in.

You do receive a response from the server in your original post, can you post the contents of the response packet?

**Comment by Bubka3** [comment]
Looks like it's getting a full packet.

```
tcpdump -nnvvXSs 1514 host 74.91.123.139
tcpdump: listening on eth0, link-type EN10MB (Ethernet), capture size 1514 bytes
19:13:54.662587 IP (tos 0x0, ttl 64, id 55429, offset 0, flags [DF], proto UDP (17), length 37)
    192.223.31.133.60035 > 74.91.123.139.27015: [bad udp cksum 809!] UDP, length 9
        0x0000:  4500 0025 d885 4000 4011 bbf7 c0df 1f85  E..%..@.@.......
        0x0010:  4a5b 7b8b ea83 6987 0011 a66d ffff ffff  J[{...i....m....
        0x0020:  5600 0000 00                             V....
19:13:54.677473 IP (tos 0x0, ttl 128, id 15726, offset 0, flags [DF], proto UDP (17), length 37)
    74.91.123.139.27015 > 192.223.31.133.60035: [udp sum ok] UDP, length 9
        0x0000:  4500 0025 3d6e 4000 8011 170f 4a5b 7b8b  E..%=n@.....J[{.
        0x0010:  c0df 1f85 6987 ea83 0011 ea83 ffff ffff  ....i...........
        0x0020:  4164 d68d 03                             Ad...
19:13:54.863764 IP (tos 0x0, ttl 64, id 55630, offset 0, flags [DF], proto UDP (17), length 53)
    192.223.31.133.52033 > 74.91.123.139.27015: [bad udp cksum 60bf!] UDP, length 25
        0x0000:  4500 0035 d94e 4000 4011 bb1e c0df 1f85  E..5.N@.@.......
        0x0010:  4a5b 7b8b cb41 6987 0021 a67d ffff ffff  J[{..Ai..!.}....
        0x0020:  5453 6f75 7263 6520 456e 6769 6e65 2051  TSource.Engine.Q
        0x0030:  7565 7279 00                             uery.
19:13:54.864482 IP (tos 0x0, ttl 64, id 55631, offset 0, flags [DF], proto UDP (17), length 35)
    192.223.31.133.44670 > 74.91.123.139.27015: [bad udp cksum edd2!] UDP, length 7
        0x0000:  4500 0023 d94f 4000 4011 bb2f c0df 1f85  E..#.O@.@../....
        0x0010:  4a5b 7b8b ae7e 6987 000f a66b ffff ffff  J[{..~i....k....
        0x0020:  5525 73                                  U%s
19:13:54.865180 IP (tos 0x0, ttl 64, id 55632, offset 0, flags [DF], proto UDP (17), length 35)
    192.223.31.133.36361 > 74.91.123.139.27015: [bad udp cksum 62f2!] UDP, length 7
        0x0000:  4500 0023 d950 4000 4011 bb2e c0df 1f85  E..#.P@.@.......
        0x0010:  4a5b 7b8b 8e09 6987 000f a66b ffff ffff  J[{...i....k....
        0x0020:  5625 73                                  V%s
19:13:54.872587 IP (tos 0x0, ttl 128, id 15999, offset 0, flags [DF], proto UDP (17), length 309)
    74.91.123.139.27015 > 192.223.31.133.52033: [udp sum ok] UDP, length 281
        0x0000:  4500 0135 3e7f 4000 8011 14ee 4a5b 7b8b  E..5>.@.....J[{.
        0x0010:  c0df 1f85 6987 cb41 0121 db0a ffff ffff  ....i..A.!......
        0x0020:  4911 416f 4347 616d 6572 732e 636f 6d20  I.AoCGamers.com.
        0x0030:  7c20 2331 203a 3a20 2a20 554e 4c49 4d49  |.#1.::.*.UNLIMI
        0x0040:  5445 4420 414d 4d4f 202f 2047 554e 5320  TED.AMMO./.GUNS.
        0x0050:  2a20 5b53 4b49 4e53 7c46 4153 5444 4c5d  *.[SKINS|FASTDL]
        0x0060:  006e 6d73 5f68 6572 7368 656c 735f 6661  .nms_hershels_fa
        0x0070:  726d 5f76 3600 6e6d 7269 6800 4e6f 204d  rm_v6.nmrih.No.M
        0x0080:  6f72 6520 526f 6f6d 2069 6e20 4865 6c6c  ore.Room.in.Hell
        0x0090:  0000 0007 0800 6477 0000 312e 302e 392e  ......dw..1.0.9.
        0x00a0:  3300 b187 6962 0e00 0000 0030 0177 6176  3...ib.....0.wav
        0x00b0:  653a 6561 726c 792c 7370 6177 6e69 6e67  e:early,spawning
        0x00c0:  3a61 6374 6976 652c 7375 7276 6976 616c  :active,survival
        0x00d0:  2c69 6e66 696e 6974 652c 7265 616c 6973  ,infinite,realis
        0x00e0:  6d3a 6f6e 2c66 663a 6f66 662c 616c 6c74  m:on,ff:off,allt
        0x00f0:  616c 6b2c 616f 6367 616d 6572 732c 6375  alk,aocgamers,cu
        0x0100:  7374 6f6d 2c63 7573 746f 6d20 6d61 7073  stom,custom.maps
        0x0110:  2c64 6564 6963 6174 6564 2c66 6173 7464  ,dedicated,fastd
        0x0120:  6c2c 696e 6669 6e69 7465 2061 0004 6c03  l,infinite.a..l.
        0x0130:  0000 0000 00                             .....
```

**Comment by Bubka3** [comment]
Forgot to mention

@Verox- If you can provide me what IPs you queried from I can ask NFO about it.

**Comment by Bubka3** [comment]
Some issue with iptables eating packets. Don't know what is just yet but if I turn it off the queries work.

**Comment by Austinb** [comment]
@Bubka3 My guess would be the default rules are enabled which basically blocks anything incoming except for ssh and maybe port 80.  I do not have any iptables rules for GameQ.  I am not sure if anyone else has any they could share either.

**Comment by Bubka3** [comment]
I figured it out, the control panel I was using as adding an inbound rule to accept from destination port 27015. It needs to be the source port!
